{"activity_effects":{"consumption":"subtract declared activity energy from remaining capacity","generation":"add declared activity energy generation to remaining capacity"},"applicability":{"activity_effect_fields":["energy_consumed_wh","energy_generated_wh","battery_energy_used_wh","battery_energy_generated_wh"],"resource_dimensions":["battery"],"time_span":"selected_activity_sequence"},"fidelity_tier":"planning_grade","id":"subsystem.power.battery.energy_storage.planning_grade","known_limits":["selected_activity_sequence_only","declared_energy_hints_only","no_continuous_power_bus_or_thermal_coupling","no_battery_degradation_or_charge_dynamics"],"model":"battery_energy_storage_planning_grade","parameters":{"capacity_wh":1000.0,"max_state_of_charge_fraction":1.0,"min_state_of_charge_fraction":0.2,"round_trip_efficiency":1.0},"schema_contract":"subsystem_model_capability.v1","source":"resource_projection_activity_energy_hints","state_variables":["capacity_wh","energy_remaining_wh","state_of_charge_fraction"],"subsystem":"power","validation_level":"assumption_declared"}
