{"activity_effects":{"downlink":"subtract storage-limited declared downlink volume from used storage","production":"add declared planned activity data volume to used storage"},"applicability":{"activity_effect_fields":["planned_data_volume_mb","data_volume_mb","estimated_data_volume_mb","estimated_storage_mb","required_downlink_mb","selected_downlink_mb"],"resource_dimensions":["storage","downlink"],"time_span":"selected_activity_sequence"},"fidelity_tier":"planning_grade","id":"subsystem.data_recorder.storage_buffer.planning_grade","known_limits":["selected_activity_sequence_only","declared_data_volume_hints_only","storage_limited_downlink_arithmetic_only","no_partition_priority_deletion_or_latency_model"],"model":"data_storage_buffer_planning_grade","parameters":{"downlink_completion_policy":"selected_activity_order","min_storage_margin":0.0,"storage_capacity_mb":1000.0},"schema_contract":"subsystem_model_capability.v1","source":"resource_projection_activity_data_volume_hints","state_variables":["storage_capacity_mb","storage_used_mb","storage_remaining_mb","storage_margin"],"subsystem":"data_recorder","validation_level":"assumption_declared"}
